Review,processed
"The product arrived on time. Packaging was great, and the quality is amazing!","['product', 'arrive', 'time', 'packaging', 'great', 'quality', 'amazing']"
THIS PRODUCT IS JUST AMAZING! I LOVE IT.,"['product', 'amaze', 'love']"
"I bought this phone for $799, and it has a 120Hz display. Totally worth it!","['buy', 'phone', 'hz', 'display', 'totally', 'worth']"
Wow!!! This product is awesome... but a bit expensive??,"['wow', 'product', 'awesome', 'bit', 'expensive']"
   The laptop works perfectly fine.   ,"['laptop', 'work', 'perfectly', 'fine']"
Check out the full product details here: https://example.com/product-details,"['check', 'full', 'product', 'detail']"
<div><h2>Great Purchase!</h2><p>I am happy with this product.</p></div>,"['great', 'purchase', 'happy', 'product']"
"The battry life is excelent, but the chargin cable is too short.","['battery', 'life', 'excellent', 'charge', 'cable', 'short']"
I can't believe it's so good! Didn't expect such quality.,"['can', 'not', 'believe', 'good', 'expect', 'quality']"
"Love this product! ???? Fast delivery ??, amazing quality! ??","['love', 'product', 'fast', 'delivery', 'amazing', 'quality']"
"TBH, I wasn't expecting much, but OMG, this is awesome!!","['honest', 'expect', 'much', 'oh', 'god', 'awesome']"
This is the best product I have ever used in my life!,"['best', 'product', 'ever', 'use', 'life']"
"The shoes were comfortable, fitting nicely, and worked perfectly for jogging.","['shoe', 'comfortable', 'fit', 'nicely', 'work', 'perfectly', 'jog']"
